id|txt|cit|data|cit
BiaLimaOfc|Vocês já pensaram em ir cagar hoje?|São Paulo, Brasil|20/10/2017 17:16|6
BiaLimaOfc|:person_walking::light_skin_tone:‍:female_sign:️|São Paulo, Brasil|20/10/2017 17:14|6
BiaLimaOfc|opa turu bom queridos?|São Paulo, Brasil|20/10/2017 17:08|6
BiaLimaOfc|Te amar me faz feliz dms :red_heart:️:rocket:|São Paulo, Brasil|20/10/2017 14:30|6
BiaLimaOfc|Olha aquela estrela brilhou no céu constelação, e a luz que vem dela acalma o meu coração, eu quero mais vem, amor demais tem :red_heart:️|São Paulo, Brasil|20/10/2017 14:30|6
BiaLimaOfc|Troy foi um merda nesse filme|São Paulo, Brasil|20/10/2017 13:36|6
BiaLimaOfc|Mas você combina mais comigo do que minha camisa favorita. :red_heart:️|São Paulo, Brasil|20/10/2017 13:30|6
BiaLimaOfc|Oq estou fazendo?? Simmmm estou assistindo HSM 1 :new_moon_face::red_heart:️|São Paulo, Brasil|20/10/2017 13:24|6
BiaLimaOfc|Inveja não é de Deus, só pra constar|São Paulo, Brasil|20/10/2017 13:23|6
BiaLimaOfc|Mania de querer seguir padrões dos outros :face_with_rolling_eyes:|São Paulo, Brasil|20/10/2017 13:09|6
BiaLimaOfc|Não se deixem influenciar pelos gostos alheios, não é porque os outros gostam que você tem obrigação de gostar :winking_face:|São Paulo, Brasil|20/10/2017 13:09|6
BiaLimaOfc|AÍ MEU CHICLETE|São Paulo, Brasil|20/10/2017 05:15|6
BiaLimaOfc|K|São Paulo, Brasil|20/10/2017 05:09|6
BiaLimaOfc|Acordei e perdi o sono|São Paulo, Brasil|20/10/2017 05:09|6
BiaLimaOfc|Agora eu to só stress|São Paulo, Brasil|20/10/2017 00:54|6
BiaLimaOfc|Às vezes eu fico seca do nada :face_with_tears_of_joy::face_with_tears_of_joy::face_with_tears_of_joy: euem|São Paulo, Brasil|20/10/2017 00:48|6
BiaLimaOfc|:sun_with_face:|São Paulo, Brasil|20/10/2017 00:47|6
BiaLimaOfc|Mano kkkkk|São Paulo, Brasil|20/10/2017 00:47|6
BiaLimaOfc|:face_with_rolling_eyes:|São Paulo, Brasil|20/10/2017 00:45|6
BiaLimaOfc|Boa pra quem não tem aula amanhã :smiling_face_with_sunglasses:|São Paulo, Brasil|20/10/2017 00:26|6
BiaLimaOfc|Tua graça cobre os meus temores, tua forte mão me guiará :two_hearts:|São Paulo, Brasil|19/10/2017 14:40|5
BiaLimaOfc|Fui :person_walking::light_skin_tone:‍:female_sign:️|São Paulo, Brasil|19/10/2017 01:16|5
BiaLimaOfc|I Love You :smiling_face_with_heart-eyes:|São Paulo, Brasil|19/10/2017 01:12|5
BiaLimaOfc|O céu se abriu o Espírito desceu, o filho revelou e o pai falou :red_heart:️|São Paulo, Brasil|19/10/2017 00:49|5
BiaLimaOfc|O céu se abriu e a terra se curvou, das águas levantou o filho de Deus :red_heart:️|São Paulo, Brasil|19/10/2017 00:48|5
BiaLimaOfc|As pessoas são tão babacas às vezes, noss|São Paulo, Brasil|18/10/2017 23:42|4
BiaLimaOfc|Esse doce é muito bom :face_savouring_delicious_food:|São Paulo, Brasil|18/10/2017 23:27|4
BiaLimaOfc|Opa turu bom kkkkkk|São Paulo, Brasil|18/10/2017 23:23|4
BiaLimaOfc|Quando eu casar vou comprar um pote desse doce só pra mim :new_moon_face::red_heart:️:red_heart:️|São Paulo, Brasil|18/10/2017 23:16|4
BiaLimaOfc|Jesus, oq eu mais quero é te ter aqui|São Paulo, Brasil|18/10/2017 21:28|4
BiaLimaOfc|Vão cagar também|São Paulo, Brasil|18/10/2017 21:28|4
BiaLimaOfc|Magoar as pessoa todo mundo magoa, vir orar que é bom nada|São Paulo, Brasil|18/10/2017 21:28|4
BiaLimaOfc|Por aí ou mais especificamente NA RUA TRÊS? :smiling_face_with_open_mouth_&_cold_sweat:|São Paulo, Brasil|18/10/2017 21:05|4
BiaLimaOfc|Sorria, você está sendo amado! :red_heart:️|São Paulo, Brasil|18/10/2017 20:45|4
BiaLimaOfc|Um dia te encontro nessas duas voltas, minha mente é mó confusão|São Paulo, Brasil|18/10/2017 20:38|4
BiaLimaOfc|Menino me da sua mão, pense bem antes de agir, se não for agora te espero lá fora então deixe-me ir :red_heart:️:musical_notes:|São Paulo, Brasil|18/10/2017 20:37|4
BiaLimaOfc|Pode falar, gasta o meu tempo eu to aqui pra escutar, não é do seu jeito tenta me mostrar|São Paulo, Brasil|18/10/2017 20:36|4
BiaLimaOfc|Agora que voltou sorri, sorri, sou rei :red_heart:️|São Paulo, Brasil|18/10/2017 20:35|4
BiaLimaOfc|Quando você se foi chorei, chorei, chorei|São Paulo, Brasil|18/10/2017 20:34|4
BiaLimaOfc|E a promessa que a chance terminou, é bobagem é melhor deixar pra trás|São Paulo, Brasil|18/10/2017 20:34|4
BiaLimaOfc|Quando a esperança de uma noite de amor, lhe trouxer vontade para viver mais..|São Paulo, Brasil|18/10/2017 20:34|4
BiaLimaOfc|Todo ser que vive, louve ao nome do senhor :red_heart:️|São Paulo, Brasil|18/10/2017 20:32|4
BiaLimaOfc|Todo joelho dobrará ao ouvir teu nome, teu santo nome :red_heart:️|São Paulo, Brasil|18/10/2017 20:31|4
BiaLimaOfc|E mesmo sendo pó com tudo o que há em mim confessarei, que céus e terra passarão mas o teu nome é eterno :red_heart:️|São Paulo, Brasil|18/10/2017 20:31|4
BiaLimaOfc|Que sono|São Paulo, Brasil|18/10/2017 20:28|4
BiaLimaOfc|Sobre o Elias ter me chamado de “toco”domingo :person_facepalming::light_skin_tone:‍:female_sign:️|São Paulo, Brasil|18/10/2017 18:48|4
BiaLimaOfc|Fui|São Paulo, Brasil|18/10/2017 00:51|4
BiaLimaOfc|Um boneco quer fazer|São Paulo, Brasil|18/10/2017 00:51|4
BiaLimaOfc|Você quer brincar na neve :snowman_without_snow:️|São Paulo, Brasil|18/10/2017 00:50|4
BiaLimaOfc|Me estressei|São Paulo, Brasil|18/10/2017 00:48|4
BiaLimaOfc|Acho que sou mais antissocial que o Ari da escola|São Paulo, Brasil|18/10/2017 00:44|4
BiaLimaOfc|Porque raios as pessoas falam palavrão? kkkkkk|São Paulo, Brasil|18/10/2017 00:27|4
BiaLimaOfc|Não te dói mais nada?|São Paulo, Brasil|18/10/2017 00:24|4
BiaLimaOfc|E com um sorriso é fácil de dizer, é muito importante bastante gargalhada :musical_notes:|São Paulo, Brasil|18/10/2017 00:24|4
BiaLimaOfc|Tudo tudo tudo é seu, é só querer|São Paulo, Brasil|18/10/2017 00:24|4
BiaLimaOfc|:wind_face:|São Paulo, Brasil|18/10/2017 00:21|4
BiaLimaOfc|Criança que eu mais amo :red_heart:️|São Paulo, Brasil|18/10/2017 00:18|4
BiaLimaOfc|Achei um vídeo da Nicole que ela tá um xuxu|São Paulo, Brasil|18/10/2017 00:18|4
BiaLimaOfc|Oi galera, turu bom?|São Paulo, Brasil|18/10/2017 00:17|4
BiaLimaOfc|A menina fica a aula inteira tirando fotos :person_facepalming::light_skin_tone:‍:female_sign:️|São Paulo, Brasil|17/10/2017 23:40|3
BiaLimaOfc|Meu dente tá doendo :thumbs_up::medium-dark_skin_tone:|São Paulo, Brasil|17/10/2017 23:08|3
BiaLimaOfc|Um açaí é uma boa|São Paulo, Brasil|17/10/2017 19:13|3
BiaLimaOfc|Tá muito calor mizera|São Paulo, Brasil|17/10/2017 19:13|3
BiaLimaOfc|Opa turu bom mores?|São Paulo, Brasil|17/10/2017 19:13|3
BiaLimaOfc|Não te troco por nada nesse mundo bb :red_heart:️|São Paulo, Brasil|17/10/2017 19:12|3
BiaLimaOfc|AAAAAAAAAA SCRR|São Paulo, Brasil|17/10/2017 19:12|3
BiaLimaOfc|Não estou sabendo lidar com meu dedo inchado|São Paulo, Brasil|17/10/2017 19:12|3
BiaLimaOfc|Eai, vamo orar? :new_moon_face:|São Paulo, Brasil|17/10/2017 19:12|3
BiaLimaOfc|Eu não to entendendo :face_with_tears_of_joy:|São Paulo, Brasil|16/10/2017 23:57|2
thepretttyhurts|Estou me sentindo mal por ter quebrado o nf mesmo que seja com fruta mas feliz pq sei que não foram tantas calorias assim|São Paulo, Brasil|26/10/2017 23:43|5
thepretttyhurts|Vou fazer ji e nos horários em que eu poderia comer eu vou fazer a dieta do ovo|São Paulo, Brasil|26/10/2017 23:42|5
thepretttyhurts|Eu jaqueira comendo uma fatia de abacaxi e duas bolachas água e sal|São Paulo, Brasil|26/10/2017 20:20|5
thepretttyhurts|Acabei de almoçar super bem (no caso bastante salada e só) agora só como amanhã|São Paulo, Brasil|26/10/2017 15:07|5
thepretttyhurts|Quando chegar na minha mf eu faço a minha tatuagem esse é o grande prêmio|São Paulo, Brasil|25/10/2017 11:07|4
thepretttyhurts|Acho que vou fazer selagem no cabelo como prêmio se perder 1kg|São Paulo, Brasil|25/10/2017 11:01|4
thepretttyhurts|Estou de nf a 17 horas|São Paulo, Brasil|25/10/2017 10:52|4
thepretttyhurts|Morrendo de vontade de comer|São Paulo, Brasil|21/10/2017 15:00|7
thepretttyhurts|Vou organizar a minha semana hoje e eu PROMETO que não vou ficar procrastinando|São Paulo, Brasil|21/10/2017 13:26|7
thepretttyhurts|Estou pensando em “me dar” prêmios se chegar nas minhas metas|São Paulo, Brasil|21/10/2017 13:14|7
thepretttyhurts|Estou de nf rezando pra conseguir chegar até o fim do dia|São Paulo, Brasil|21/10/2017 13:08|7
maluxxalves|Eu jogando uno sou o trinca, ta lá um 6 verde ele poe um 3 amarelo, etc|São Paulo, Brasil|26/10/2017 23:24|5
maluxxalves|Motivo pelo qual eu fiz minha mae assinar spotify premium : queria ouvir o álbum de enrolados|São Paulo, Brasil|26/10/2017 23:21|5
maluxxalves|Preciso urgente de um ortopedista, to me sentindo o próprio Reus de tanta dor na perna já|São Paulo, Brasil|26/10/2017 23:19|5
maluxxalves|Os mano da minha sala tem que começar a aprender que n pode foder mais da metade da sala só pq eles conseguem ir p escola e o resto n|São Paulo, Brasil|26/10/2017 08:27|5
maluxxalves|Perdi a oportunidade de pegar 2 ônibus vazios, to triste dms|São Paulo, Brasil|26/10/2017 08:24|5
maluxxalves|Fui sair de casa achando que era a tempestade do ex men e me fodi pq agora to sem mochila, sem tênis, sem caderno, sem nada|São Paulo, Brasil|26/10/2017 08:23|5
maluxxalves|Eu to mt ansiosa p ver ele mano, pra que ele foi me falar isso|São Paulo, Brasil|25/10/2017 22:12|4
maluxxalves|Sdds 2016 quando minha mãe me buscava na escola p ir tomar açaí, hoje em dia se eu pedir p ela ir, ela me da dois socos na boca|São Paulo, Brasil|25/10/2017 22:11|4
maluxxalves|Tentando entender o que eu fiz p meu joelho estar tão dolorido assim|São Paulo, Brasil|25/10/2017 22:10|4
maluxxalves|Amanha é dia de comer paçoca, amém marciano|São Paulo, Brasil|25/10/2017 00:17|4
maluxxalves|velho eu dormi o dia todo pq eu fui saber agora que ready for it é o novo single e ta mt ex men|São Paulo, Brasil|23/10/2017 23:09|2
maluxxalves|odeio tpm pq eu fico chateada com qualquer coisinha|São Paulo, Brasil|23/10/2017 23:05|2
maluxxalves|incrível como eu me machuco cada vez mais vendo coisa que eu não devo, uma hora serve pra parar de ser trouxa|São Paulo, Brasil|23/10/2017 22:44|2
maluxxalves|Eu não tinha me tocado do quanto o tempo ta passando rápido até dar minhas bonecas pra minha irmã, to ficando bem abalada|São Paulo, Brasil|21/10/2017 13:20|7
maluxxalves|Eu tenho mo orgulho de falar isso, antes eu não suportava ver a felicidade das pessoas que me fizeram mal|São Paulo, Brasil|21/10/2017 01:47|7
maluxxalves|Tio, eu torço mt pelo relacionamento de algumas pessoas que passaram pela minha vida, de certo modo são muito importantes p mim|São Paulo, Brasil|21/10/2017 01:45|7
maluxxalves|Foda quando a pessoa se afasta de vc porque quis e mesmo assim vc deseja o melhor p ela, mesmo que não seja junto contigo|São Paulo, Brasil|21/10/2017 01:39|7
maluxxalves|Pq se fosse eu, eu infartava na frente do bandido e ele que ia me levar no hospital|São Paulo, Brasil|20/10/2017 22:56|6
maluxxalves|As vezes eu queria ter a tranquilidade da minha mãe, " é só um carro gente, ta tudo certo, o seguro paga"|São Paulo, Brasil|20/10/2017 22:55|6
maluxxalves|" coitado do ladrão que me roubar pra pegar essa bosta de carro" eu na vida sou meu pai falando de assalto de carro|São Paulo, Brasil|20/10/2017 22:52|6
maluxxalves|Esse rep da TS vai me decepcionar muito eu to sentindo, esperei 3 anos p ouvir umas musicas meio eu, meio lixo sla|São Paulo, Brasil|20/10/2017 10:25|6
maluxxalves|Minha vontade de ir p escola ta bem grande, faz dois dias q eu chego p terceira aula, isso pq eu só tenho vermelha, triste|São Paulo, Brasil|20/10/2017 10:24|6
maluxxalves|Um bagulho que eu n gosto é gente parada do lado esquerdo da escada rolante, puta merda|São Paulo, Brasil|20/10/2017 10:23|6
maluxxalves|Mano eu tive um sonho mt estranho hoje velho KKKKKKKKKK n aguento mais sonhar c os meninos do 1B e são umas coisas mó aleatórias|São Paulo, Brasil|20/10/2017 10:23|6
maluxxalves|graças a deus q n faço certas coisas, sai fora parar de fzr coisas que eu gosto pelos outros, me envolvo com quem faz pior que eu|São Paulo, Brasil|19/10/2017 23:21|5
maluxxalves|um sonho que eu tenho é ouvir bad blood ao vivo|São Paulo, Brasil|19/10/2017 23:06|5
maluxxalves|a mina q acabou c a minha vida na setima serie me chamou no fb, eu to bem desesperada|São Paulo, Brasil|19/10/2017 23:02|5
maluxxalves|eu quero mt ficar acordada p ouvir a nova musica da ts, mas 2 da manha n da n|São Paulo, Brasil|19/10/2017 22:56|5
maluxxalves|Devolve td q vc comeu no meu trabalho de adk pq vc n mereceu sua ridícula|São Paulo, Brasil|18/10/2017 01:42|4
maluxxalves|Agora q eu já vi a diferença dos cursos de adm nas etes eu posso me estabelecer novamente na minha terra São Paulo|São Paulo, Brasil|18/10/2017 01:41|4
maluxxalves|Ultimamente eu olho p certas pessoas e penso "caralho eu devia ter deixado meca em 1°" eu ia estar mt fodida porem n teria vc sua maldita|São Paulo, Brasil|18/10/2017 01:10|4
maluxxalves|Queria marcar "Daniel e igreja católica pra ele virar padre" tarde dms pq ele ta pegando minha amg af|São Paulo, Brasil|18/10/2017 01:01|4
maluxxalves|Eu vejo o matheus marcando a dani dá vontade de bater neles dois ate eles me adotarem, n aguento|São Paulo, Brasil|18/10/2017 00:11|4
maluxxalves|Quem eu queria marcar no bang eu n posso pq ia descer logo o murro em mim, decepcionado porém conformada|São Paulo, Brasil|18/10/2017 00:09|4
maluxxalves|queria q o @ me marcasse nesse bang do gp da ete, af|São Paulo, Brasil|17/10/2017 23:21|3
maluxxalves|E não satisfeita eu levei outro na rua de casa, ai minha rainha chegou e me ofereceu carona, minha mae é dms|São Paulo, Brasil|17/10/2017 22:48|3
maluxxalves|Hj eu tava andando na rua e levei mo rola, tinha umas mina em um carro e as desgraçadas começaram a rir e gritar me zoando, triste|São Paulo, Brasil|17/10/2017 22:47|3
maluxxalves|Cabelo da mariana ta tao lindo q amanha eu vou dar dois soco na boca dela|São Paulo, Brasil|17/10/2017 22:38|3
maluxxalves|Mano eu tenho mt alucinação quando eu acordo, fico meio atordoada, n sei se foi vdd ou n|São Paulo, Brasil|17/10/2017 22:36|3
maluxxalves|Mt bom dormir no busao, o problema foi usar o tiozinho de travesseiro|São Paulo, Brasil|17/10/2017 22:36|3
maluxxalves|Eu sou mt monga, n sei pegar ônibus, boa noite p quem quase foi parar no estadio do Corinthians por n prestar atenção|São Paulo, Brasil|17/10/2017 22:34|3
maluxxalves|Not afraid anymore é uma das melhores músicas da Halsey, pqp|São Paulo, Brasil|17/10/2017 22:32|3
maluxxalves|Bem chateada q as pessoas acham q eu sou depressiva, gente do céu eu sou mó feliz, falou pudim p mim eu já to rachando o bico|São Paulo, Brasil|17/10/2017 22:29|3
maluxxalves|Nunca vou esquecer o cara da marechal me parando duas vezes perguntando se eu já tinha pego o coração dele kkkkkkkkk|São Paulo, Brasil|17/10/2017 22:28|3
maluxxalves|hj eu to bem chateada cmg mesma kkkk rindo de nervoso|São Paulo, Brasil|16/10/2017 22:37|2
SPFCGermano|Agr são paulo vai pra frente :red_heart::red_heart:|São Paulo, Brasil|26/10/2017 23:19|5
SPFCGermano|Esses últimos dias, ñ to me sentindo bem :persevering_face::persevering_face:|São Paulo, Brasil|26/10/2017 23:18|5
shwmdario|Que meu peso tenha subido por culpa da massa muscular se não for eu me mato|São Paulo, Brasil|26/10/2017 23:44|5
shwmdario|Ela tem 14 anos fiquei chocada, achei que tivesse uns 17|São Paulo, Brasil|26/10/2017 23:39|5
shwmdario|Fiz amizade com uma mina mo legal lá no circo|São Paulo, Brasil|26/10/2017 23:39|5
shwmdario|Queria saber como essas minas consegue ficar bonitas com mascara na cara, eu coloco e corro pra me trancar no banheiro|São Paulo, Brasil|26/10/2017 23:17|5
shwmdario|Mentira, eu to parecendo o capeta|São Paulo, Brasil|26/10/2017 23:17|5
shwmdario|To com aquelas máscaras pretas na cara me sentindo a blogueirinha|São Paulo, Brasil|26/10/2017 23:17|5
shwmdario|Vou deitar pra não jantar|São Paulo, Brasil|26/10/2017 22:35|5
shwmdario|Sentada no chão do quarto e de toalha, as always|São Paulo, Brasil|26/10/2017 22:28|5
shwmdario|TA EU TO REALMENTE ATRASADA mas a preguiça ta grande tbm|São Paulo, Brasil|26/10/2017 18:33|5
shwmdario|deitei comemorando meus 51kg, agora to chorando os 53 que voltaram MANO COMO ISSO É POSSÍVEL GLL|São Paulo, Brasil|26/10/2017 18:32|5
shwmdario|eu to com tanta preguiça de ir a pé, alguém vem me buscar|São Paulo, Brasil|26/10/2017 18:29|5
shwmdario|CARALHO EU TO ATRASADA AAAAAAAAAAAAAAAAAAAAA|São Paulo, Brasil|26/10/2017 18:28|5
shwmdario|eu sou assim com quem eu me importo|São Paulo, Brasil|26/10/2017 18:28|5
shwmdario|mas eu gosto de mandar mensagem de madrugada, textos dizendo q amo a pessoa, comprar presentes, entregar uma florzinha msm q seja do jardim|São Paulo, Brasil|26/10/2017 18:27|5
shwmdario|desculpa, eu sou muito cheia de amor e eu gosto de demonstrar isso. desculpa mesmo se as vezes fica chato galera|São Paulo, Brasil|26/10/2017 18:25|5
shwmdario|não que na maioria das vezes seja mentira, 99% do tempo eu realmente to valorizando mais que a pessoa|São Paulo, Brasil|26/10/2017 18:25|5
shwmdario|smp acho q eu sou a que mais se esforça, dai acabo parando por sentir q to incomodando ou pq to com medo de ser trouxa e a pessoa fica "uai"|São Paulo, Brasil|26/10/2017 18:24|5
shwmdario|sei lá, eu sou meio paranoiada|São Paulo, Brasil|26/10/2017 18:22|5
shwmdario|eu sempre sinto que eu sou a que mais se importa em tudo|São Paulo, Brasil|26/10/2017 18:22|5
shwmdario|escolhi o Alec mesmo o Mag sendo o amor da minha vida pq ele foi forte e corajoso, enfrentou todas as barreiras (inclusive a familia) pra+|São Paulo, Brasil|26/10/2017 18:17|5
shwmdario|GENTE A MAGGIE DE TERNO EU TO APAIXONADA|São Paulo, Brasil|26/10/2017 18:14|5
shwmdario|lush pra que quando a gente pode usar açúcar, corante e essência???????????????????|São Paulo, Brasil|26/10/2017 18:09|5
shwmdario|to tentando achar a essência de baunilha MAS SUMIU|São Paulo, Brasil|26/10/2017 18:09|5
shwmdario|o ruim é que o corante mancha td os dedos e mal fica na boca afe|São Paulo, Brasil|26/10/2017 18:08|5
shwmdario|eu fiz droga caseira, eu sou top|São Paulo, Brasil|26/10/2017 18:08|5
shwmdario|MAGGIE lembrei|São Paulo, Brasil|26/10/2017 18:06|5
shwmdario|namorada da alex que eu esqueci o nome, vc é incrível aaaaaaaaaaaaaaaaaa|São Paulo, Brasil|26/10/2017 18:06|5
shwmdario|"você merece um romance incrível com uma mulher que é louca por você"|São Paulo, Brasil|26/10/2017 18:05|5
shwmdario|"me desculpe, eu estava tão ocupada curando minhas antigas feridas que eu esqueci de olhar pra essa mulher maravilhosa na minha frente"|São Paulo, Brasil|26/10/2017 18:05|5
shwmdario|meu tt não ta funcionando no celular Raziel me ajuda|São Paulo, Brasil|26/10/2017 18:03|5
shwmdario|vou dormir mesmo e foda se a geografia|São Paulo, Brasil|26/10/2017 02:00|5
shwmdario|vontade de entupir meu quarto de flores|São Paulo, Brasil|26/10/2017 01:57|5
shwmdario|Eu desenho flor em tudo|São Paulo, Brasil|26/10/2017 01:57|5
shwmdario|se tem uma coisa que eu amo essa coisa é flor puta merda|São Paulo, Brasil|26/10/2017 01:57|5
shwmdario|pior é que eu não posso flt nada pq vou acabar ficando como chata e babaca, mas quando a pessoa não me desce sempre da merda no final|São Paulo, Brasil|26/10/2017 01:54|5
shwmdario|como já dizia nosso queridissimo boçal Sai da minha aba|São Paulo, Brasil|26/10/2017 01:51|5
shwmdario|me irrita até o cu|São Paulo, Brasil|26/10/2017 01:50|5
shwmdario|VAI CURTIR AS COISAS DA TUA VÓ DESGRAÇA|São Paulo, Brasil|26/10/2017 01:50|5
shwmdario|AH LINDA SAI PRA LÁ QUE EU NÃO TE QUERO NA MINHA VIDA NÃO|São Paulo, Brasil|26/10/2017 01:48|5
shwmdario|eu sinto o olho gordo do ser humano, não sei nem explicar|São Paulo, Brasil|26/10/2017 01:47|5
shwmdario|Se algum dia eu esbarrar com essa mina eu durmo dentro duma banheira cheia de pedra pra tirar a energia ruim|São Paulo, Brasil|26/10/2017 01:46|5
shwmdario|essa menina ainda não me desce|São Paulo, Brasil|26/10/2017 01:41|5
shwmdario|QUE QUE A VAGABUNDA TA ME STALKEANDO|São Paulo, Brasil|26/10/2017 01:38|5
shwmdario|Eu saio entrando nuns tts aleatórios e salvo tudo meu deus|São Paulo, Brasil|26/10/2017 01:01|5
shwmdario|calma preciso usar o meme da nina pra tudo agora|São Paulo, Brasil|26/10/2017 00:40|5
shwmdario|pau no cu da geografia|São Paulo, Brasil|26/10/2017 00:40|5
shwmdario|escutei ele reclamando lá da cozinha, jaja ele ta aqui abrindo a porta do meu quarto pra falar merda|São Paulo, Brasil|25/10/2017 23:25|4
shwmdario|me deixa estudar em paz embuste|São Paulo, Brasil|25/10/2017 23:24|4
shwmdario|vai tomar no cu meu pai é muito chato|São Paulo, Brasil|25/10/2017 23:23|4
shwmdario|o ruim de reler after é que eu não consigo mais odiar tanto a Molly, mesmo a cena da briga sendo icônica|São Paulo, Brasil|25/10/2017 23:14|4
shwmdario|vou reler after quando eu acabar LoS, deu saudades de passar raiva querendo socar a Tessa e o Hardin|São Paulo, Brasil|25/10/2017 23:12|4
shwmdario|51.9 :red_heart:|São Paulo, Brasil|25/10/2017 21:48|4
shwmdario|Era pra deixar 15 minutos, já tá faz meia hora e eu to sentada no chão do quarto de toalha como sempre|São Paulo, Brasil|25/10/2017 21:47|4
shwmdario|EU ESQUECI A SOJA NA ÁGUA E FUI TOMAR BANHO KKKKKKKKKKKK DEVE ESTAR TD INCHADO JÁ|São Paulo, Brasil|25/10/2017 21:46|4
shwmdario|quase morri atropelada quando eu tava indo pq eu vou com os dois fones de ouvido pq me recuso a ouvir cantada babaca mas to viva|São Paulo, Brasil|25/10/2017 21:09|4
shwmdario|melhor coisa foi chegar no circo e encontrar umas meninas aq do meu prédio NÃO TIVE QUE VOLTAR A PÉ QUE DELICINHA|São Paulo, Brasil|25/10/2017 21:09|4
shwmdario|EU ACABEI DE TOMAR UM SUSTO MTO SENSACIONAL KKKKKKKKKM|São Paulo, Brasil|25/10/2017 21:07|4
shwmdario|Tenho que estudar geografia mas a preguiça ta enorme|São Paulo, Brasil|25/10/2017 21:06|4
shwmdario|Fiz lira e não fiquei roxa EU OUVI UM AMÉM?|São Paulo, Brasil|25/10/2017 20:57|4
shwmdario|nunca mais faço aula sem comer jesus cristo|São Paulo, Brasil|25/10/2017 20:55|4
shwmdario|Quase cai do trapézio de tanta tontura|São Paulo, Brasil|25/10/2017 20:54|4
shwmdario|to me tremendo toda real|São Paulo, Brasil|25/10/2017 19:00|4
shwmdario|AI DEUS VAI COMEÇAR|São Paulo, Brasil|25/10/2017 18:59|4
shwmdario|5 minutos pra começar ai ai|São Paulo, Brasil|25/10/2017 18:55|4
shwmdario|evitando olhar pro Lincoln com medo dele me reconhecer|São Paulo, Brasil|25/10/2017 18:53|4
shwmdario|eu to quase desmaiando de fraqueza e a aula nem começou|São Paulo, Brasil|25/10/2017 18:52|4
shwmdario|eu to muito fraca|São Paulo, Brasil|25/10/2017 18:49|4
shwmdario|nossa mas eu vou levar um capote da lira, certeza|São Paulo, Brasil|25/10/2017 18:48|4
shwmdario|sem força e gay|São Paulo, Brasil|25/10/2017 18:48|4
shwmdario|to tremendo feito um bicho|São Paulo, Brasil|25/10/2017 18:48|4
shwmdario|Espero que (1) ele não me reconheça e (2) esteja menos insuportável|São Paulo, Brasil|25/10/2017 18:46|4
shwmdario|infelizmente tendo que olhar pra cara do Lincoln dnv|São Paulo, Brasil|25/10/2017 18:45|4
shwmdario|Falei "fuck it" pra uma coisa dai eu lembrei do Chris e comecei a chorar.|São Paulo, Brasil|25/10/2017 08:52|4
shwmdario|eu to bem em f1 de bio e f2 de quimica agora fis meus amigos eu não entendi nada|São Paulo, Brasil|25/10/2017 02:22|4
shwmdario|preciso estudar fisica aaaaaaaaaaaaaaaaaaaaaaaaaaaaaaaaaa|São Paulo, Brasil|25/10/2017 02:22|4
shwmdario|vo gruda minha bunda na cadeira antes que eu lavante e vá comer mais uma vez|São Paulo, Brasil|24/10/2017 23:51|3
shwmdario|to bem triste pq coloquei couve no prato não era couve era escarola comi chorando pq é ruim|São Paulo, Brasil|24/10/2017 23:39|3
shwmdario|incclusive hoje eu to a taurina pura meu deus já jantei duas vezes|São Paulo, Brasil|24/10/2017 23:39|3
shwmdario|meu lado taurino fala mais alto em cada crise de ciumes|São Paulo, Brasil|24/10/2017 23:38|3
shwmdario|triste pq minha soja acabou e gay|São Paulo, Brasil|24/10/2017 23:26|3
shwmdario|Me fodi muito, preciso tirar 4 amanhã ai deus|São Paulo, Brasil|24/10/2017 21:18|3
shwmdario|Eu dou risada é uma das melhores músicas da Manu Gavassi|São Paulo, Brasil|24/10/2017 20:39|3
shwmdario|POR ISSO A GENTE TEVE UM FIM MELHOR ASSIM MELHOR ASSIM|São Paulo, Brasil|24/10/2017 20:39|3
shwmdario|São Paulo combina com o seu humor|São Paulo, Brasil|24/10/2017 20:38|3
shwmdario|Você é tão perfeito e por isso não tem jeito o mundo inteiro quer ter namorar|São Paulo, Brasil|24/10/2017 20:37|3
shwmdario|Seria uma pena se você levasse um tombo desse trono que só você vê|São Paulo, Brasil|24/10/2017 20:36|3
shwmdario|Meu sonho é fazer cosplay clizzy com alguém|São Paulo, Brasil|24/10/2017 19:57|3
shwmdario|Minha internet fica cada vez pior|São Paulo, Brasil|24/10/2017 19:55|3
shwmdario|CARALHO O CLIPE DE HAVANA TÁ BOM DEMAIS|São Paulo, Brasil|24/10/2017 19:41|3
shwmdario|Fico toda feliz pq eu comi dai chega meu organismo e fala que engraçado vc chegou em casa né corre pro banheiro antes que saia pelo nariz|São Paulo, Brasil|24/10/2017 19:23|3
shwmdario|CARALHO QUASE QUE EU VOMITO NA CASA TODA QUE HORROR|São Paulo, Brasil|24/10/2017 19:22|3
shwmdario|7 da manhã e eu to vendo tt de textinhos EU SOU MTO VICIADA NISSO AAAAAAAA|São Paulo, Brasil|24/10/2017 08:54|3
shwmdario|Sério eu olho pras coisas que ela fala e já sinto aquele tom de quem vai foder a minha vida todinha|São Paulo, Brasil|24/10/2017 08:45|3
shwmdario|O ranço da menina não passou ainda|São Paulo, Brasil|24/10/2017 08:44|3
shwmdario|Zero vontade de estudar pra pgb|São Paulo, Brasil|24/10/2017 08:41|3
shwmdario|6 da manhã e a menina me entupindo de snap pelo amor de raziel seus snaps são chatos|São Paulo, Brasil|24/10/2017 08:33|3
